{
  "$schema": "https://json-schema.org/draft/2020-12/schema",
  "$id": "https://schemas.ecp-protocol.org/0.1.0/registration.schema.json",
  "title": "ECP Registration",
  "description": "Immutable, append-only registration record. A registered evaluation freezes protocol version, case version, target (system) version, condition, success criterion and verification rule BEFORE any execution. registration_hash = SHA-256 over the ECP-CANONICAL-JSON-1.0 serialization of this document with the top-level registration_hash field removed. Registration records are never edited; corrections are new records that supersede, never overwrite.",
  "type": "object",
  "required": [
    "ecp_object",
    "registration_id",
    "protocol_version",
    "schema_version",
    "evaluation_id",
    "system",
    "case",
    "condition",
    "success_criterion",
    "verification_rule",
    "registered_at",
    "hash_algorithm",
    "canonicalization",
    "registration_hash",
    "immutability"
  ],
  "properties": {
    "ecp_object": { "const": "registration" },
    "registration_id": {
      "type": "string",
      "pattern": "^ECP-REG-[A-Za-z0-9][A-Za-z0-9._:-]*$"
    },
    "protocol_version": { "$ref": "#/$defs/semver" },
    "schema_version": { "$ref": "#/$defs/semver" },
    "evaluation_id": {
      "type": "string",
      "pattern": "^ECP-EVAL-[A-Za-z0-9][A-Za-z0-9._:-]*$"
    },
    "system": {
      "type": "object",
      "required": ["system_id", "system_version"],
      "properties": {
        "system_id": {
          "type": "string",
          "pattern": "^ECP-SYSTEM-[A-Za-z0-9][A-Za-z0-9._:-]*$"
        },
        "system_version": { "$ref": "#/$defs/semver" }
      },
      "additionalProperties": false
    },
    "case": {
      "type": "object",
      "required": ["case_id", "case_version"],
      "properties": {
        "case_id": {
          "type": "string",
          "pattern": "^ECP-CASE-[A-Za-z0-9][A-Za-z0-9._:-]*$"
        },
        "case_version": { "$ref": "#/$defs/semver" }
      },
      "additionalProperties": false
    },
    "condition": {
      "type": "object",
      "required": ["constraints"],
      "properties": {
        "constraints": {
          "type": "array",
          "minItems": 1,
          "items": { "type": "string", "minLength": 1 }
        },
        "permitted_resources": {
          "type": "array",
          "items": { "type": "string" }
        }
      },
      "additionalProperties": false,
      "description": "Frozen copy of the case condition at registration time."
    },
    "success_criterion": {
      "type": "string",
      "minLength": 1,
      "description": "Frozen copy of the success criterion at registration time."
    },
    "verification_rule": {
      "type": "object",
      "required": ["rule_id", "rule_type"],
      "properties": {
        "rule_id": { "type": "string", "minLength": 1 },
        "rule_type": {
          "enum": ["exact-match", "equivalence-class", "derivation-check", "procedural", "external-oracle", "other"]
        }
      },
      "additionalProperties": false,
      "description": "Frozen reference to the verification rule at registration time."
    },
    "registered_at": { "$ref": "#/$defs/iso8601_utc" },
    "hash_algorithm": { "const": "sha256" },
    "canonicalization": { "const": "ECP-CANONICAL-JSON-1.0" },
    "registration_hash": { "$ref": "#/$defs/sha256_hex" },
    "immutability": {
      "const": "append-only",
      "description": "Machine-checkable marker of the registration immutability semantics."
    },
    "supersedes": {
      "type": "string",
      "pattern": "^ECP-REG-[A-Za-z0-9][A-Za-z0-9._:-]*$",
      "description": "Optional pointer to the registration record this record replaces (append-only correction)."
    },
    "notes": {
      "type": "array",
      "items": { "type": "string" },
      "description": "Optional commentary (covered by registration_hash)."
    }
  },
  "additionalProperties": false,
  "$defs": {
    "semver": {
      "type": "string",
      "pattern": "^(0|[1-9]\\d*)\\.(0|[1-9]\\d*)\\.(0|[1-9]\\d*)(?:-((?:0|[1-9]\\d*|\\d*[a-zA-Z-][0-9a-zA-Z-]*)(?:\\.(?:0|[1-9]\\d*|\\d*[a-zA-Z-][0-9a-zA-Z-]*))*))?(?:\\+([0-9a-zA-Z-]+(?:\\.[0-9a-zA-Z-]+)*))?$"
    },
    "sha256_hex": {
      "type": "string",
      "pattern": "^[0-9a-f]{64}$"
    },
    "iso8601_utc": {
      "type": "string",
      "pattern": "^\\d{4}-\\d{2}-\\d{2}T\\d{2}:\\d{2}:\\d{2}(\\.\\d+)?Z$"
    }
  }
}
